{
  "version": "1.0",
  "source_document_sha256": "b08c5e1a12ee7eb0e44e4f05c3293d9fc2bf0d6bfc6b80fcc7928362fcb58615",
  "source_document_path": "D:\\InkSpectrum\\OpenMontage\\projects\\class-5-social-part-0-chapter-2-earth-movement\\artifacts\\extracted_content.md",
  "entries": [
    {
      "source_block_id": "p0001-b0001",
      "page_number": 1,
      "block_type": "chapter_title",
      "semantic_role": "lesson_content",
      "source_text_sha256": "71f1db6343c4f333d8b38ac354e34fb9d9f0b5406b27f80aa1e2ff65fd2d0734",
      "required": true,
      "status": "pending",
      "mappings": {
        "narration_segment_ids": [],
        "screen_ids": [],
        "visual_cue_ids": []
      },
      "omission_reason": null
    },
    {
      "source_block_id": "p0001-b0002",
      "page_number": 1,
      "block_type": "section_heading",
      "semantic_role": "lesson_content",
      "source_text_sha256": "301b843724f10ba740cee6f3a1c67ec9828e73e12f9f84017b8188ec6115541d",
      "required": true,
      "status": "pending",
      "mappings": {
        "narration_segment_ids": [],
        "screen_ids": [],
        "visual_cue_ids": []
      },
      "omission_reason": null
    },
    {
      "source_block_id": "p0001-b0003",
      "page_number": 1,
      "block_type": "paragraph",
      "semantic_role": "lesson_content",
      "source_text_sha256": "2126a5b8b47ea823056298e79cee704da466274601bafcd91e37ebff4dfecfa7",
      "required": true,
      "status": "pending",
      "mappings": {
        "narration_segment_ids": [],
        "screen_ids": [],
        "visual_cue_ids": []
      },
      "omission_reason": null
    },
    {
      "source_block_id": "p0001-b0004",
      "page_number": 1,
      "block_type": "bullet",
      "semantic_role": "lesson_content",
      "source_text_sha256": "9188ca53b6735903941e4dda97e8b49e11ade92947544a8b924ee3136e8696fe",
      "required": true,
      "status": "pending",
      "mappings": {
        "narration_segment_ids": [],
        "screen_ids": [],
        "visual_cue_ids": []
      },
      "omission_reason": null
    },
    {
      "source_block_id": "p0001-b0005",
      "page_number": 1,
      "block_type": "bullet",
      "semantic_role": "lesson_content",
      "source_text_sha256": "7676d088a28339c32a168c9c830e7f4ec0296c3085a134c8c5d52b98ac3df7ea",
      "required": true,
      "status": "pending",
      "mappings": {
        "narration_segment_ids": [],
        "screen_ids": [],
        "visual_cue_ids": []
      },
      "omission_reason": null
    },
    {
      "source_block_id": "p0001-b0006",
      "page_number": 1,
      "block_type": "bullet",
      "semantic_role": "lesson_content",
      "source_text_sha256": "102e740bf06ebedeab952885c345a4b7071eab366960aabb7025a461967fb05d",
      "required": true,
      "status": "pending",
      "mappings": {
        "narration_segment_ids": [],
        "screen_ids": [],
        "visual_cue_ids": []
      },
      "omission_reason": null
    },
    {
      "source_block_id": "p0001-b0007",
      "page_number": 1,
      "block_type": "bullet",
      "semantic_role": "lesson_content",
      "source_text_sha256": "0d4a37b429333068b17ed05981338ce44d04a04da9ef93e5dc63cb230a5f5417",
      "required": true,
      "status": "pending",
      "mappings": {
        "narration_segment_ids": [],
        "screen_ids": [],
        "visual_cue_ids": []
      },
      "omission_reason": null
    },
    {
      "source_block_id": "p0001-b0008",
      "page_number": 1,
      "block_type": "bullet",
      "semantic_role": "lesson_content",
      "source_text_sha256": "2630ee89de02e02ff090bd4cdfbe671bad1274a2087d872aa4810c22f65813f4",
      "required": true,
      "status": "pending",
      "mappings": {
        "narration_segment_ids": [],
        "screen_ids": [],
        "visual_cue_ids": []
      },
      "omission_reason": null
    },
    {
      "source_block_id": "p0001-b0009",
      "page_number": 1,
      "block_type": "bullet",
      "semantic_role": "lesson_content",
      "source_text_sha256": "3069dc56a2e8931e6e00d600dc0829235185fb70571e658451c11d1b455ebe25",
      "required": true,
      "status": "pending",
      "mappings": {
        "narration_segment_ids": [],
        "screen_ids": [],
        "visual_cue_ids": []
      },
      "omission_reason": null
    },
    {
      "source_block_id": "p0001-b0010",
      "page_number": 1,
      "block_type": "section_heading",
      "semantic_role": "activity",
      "source_text_sha256": "ea91cb32cce48241b410a0aa2fbeb9219b222730f1fc44ee84db5e7760594f2a",
      "required": true,
      "status": "pending",
      "mappings": {
        "narration_segment_ids": [],
        "screen_ids": [],
        "visual_cue_ids": []
      },
      "omission_reason": null
    },
    {
      "source_block_id": "p0001-b0011",
      "page_number": 1,
      "block_type": "activity",
      "semantic_role": "activity",
      "source_text_sha256": "1c21f6d42d35695d6e0f109d73cf28c679f66a41963149e8d7de8e4f2e048ad8",
      "required": true,
      "status": "pending",
      "mappings": {
        "narration_segment_ids": [],
        "screen_ids": [],
        "visual_cue_ids": []
      },
      "omission_reason": null
    },
    {
      "source_block_id": "p0001-b0012",
      "page_number": 1,
      "block_type": "section_heading",
      "semantic_role": "lesson_content",
      "source_text_sha256": "e5c7953237fd5044ea320a6c0c6da0155eec8bb9eb6a69c3033263c26ac15bdb",
      "required": true,
      "status": "pending",
      "mappings": {
        "narration_segment_ids": [],
        "screen_ids": [],
        "visual_cue_ids": []
      },
      "omission_reason": null
    },
    {
      "source_block_id": "p0001-b0013",
      "page_number": 1,
      "block_type": "paragraph",
      "semantic_role": "lesson_content",
      "source_text_sha256": "41903947b99763919f49264f9c7d88d0a8893cd3ed532f24aeb46886660ec592",
      "required": true,
      "status": "pending",
      "mappings": {
        "narration_segment_ids": [],
        "screen_ids": [],
        "visual_cue_ids": []
      },
      "omission_reason": null
    },
    {
      "source_block_id": "p0001-b0014",
      "page_number": 1,
      "block_type": "figure",
      "semantic_role": "lesson_content",
      "source_text_sha256": "eaae676dd4440a6ed62948264a2e8c429da292e121342f4749000d7fe303aabc",
      "required": true,
      "status": "pending",
      "mappings": {
        "narration_segment_ids": [],
        "screen_ids": [],
        "visual_cue_ids": []
      },
      "omission_reason": null
    },
    {
      "source_block_id": "p0002-b0001",
      "page_number": 2,
      "block_type": "section_heading",
      "semantic_role": "lesson_content",
      "source_text_sha256": "c17eebdc84c8f5a8418152d9e60a0ce2327ee1a8fb86620cda6aefb303cded93",
      "required": true,
      "status": "pending",
      "mappings": {
        "narration_segment_ids": [],
        "screen_ids": [],
        "visual_cue_ids": []
      },
      "omission_reason": null
    },
    {
      "source_block_id": "p0002-b0002",
      "page_number": 2,
      "block_type": "paragraph",
      "semantic_role": "lesson_content",
      "source_text_sha256": "48a103126cd7f39df41668b5abda6d61c57cd4e68adb1648a905d52dfa29266e",
      "required": true,
      "status": "pending",
      "mappings": {
        "narration_segment_ids": [],
        "screen_ids": [],
        "visual_cue_ids": []
      },
      "omission_reason": null
    },
    {
      "source_block_id": "p0002-b0003",
      "page_number": 2,
      "block_type": "paragraph",
      "semantic_role": "lesson_content",
      "source_text_sha256": "d301406b73f71e830ee87fe840a9052f8a1e386393f4b1908400e09ad6341971",
      "required": true,
      "status": "pending",
      "mappings": {
        "narration_segment_ids": [],
        "screen_ids": [],
        "visual_cue_ids": []
      },
      "omission_reason": null
    },
    {
      "source_block_id": "p0002-b0004",
      "page_number": 2,
      "block_type": "paragraph",
      "semantic_role": "lesson_content",
      "source_text_sha256": "cdeef62f69b0b25f83287324c7778ad7219002ecc6ab937befd52f2844a16c95",
      "required": true,
      "status": "pending",
      "mappings": {
        "narration_segment_ids": [],
        "screen_ids": [],
        "visual_cue_ids": []
      },
      "omission_reason": null
    },
    {
      "source_block_id": "p0002-b0005",
      "page_number": 2,
      "block_type": "section_heading",
      "semantic_role": "lesson_content",
      "source_text_sha256": "57b5e2fc1bba18bb4f54084af57ffe86b3bb3d925c281043e84a05eb4b19317c",
      "required": true,
      "status": "pending",
      "mappings": {
        "narration_segment_ids": [],
        "screen_ids": [],
        "visual_cue_ids": []
      },
      "omission_reason": null
    },
    {
      "source_block_id": "p0002-b0006",
      "page_number": 2,
      "block_type": "paragraph",
      "semantic_role": "lesson_content",
      "source_text_sha256": "9e4faa90fc87c66929897fb9e475014faa07dd85b0e839458013688327ba498c",
      "required": true,
      "status": "pending",
      "mappings": {
        "narration_segment_ids": [],
        "screen_ids": [],
        "visual_cue_ids": []
      },
      "omission_reason": null
    },
    {
      "source_block_id": "p0002-b0007",
      "page_number": 2,
      "block_type": "paragraph",
      "semantic_role": "lesson_content",
      "source_text_sha256": "91888f24b10ff4369c56f4cc0ed8db6a824cb02f88f687f418e13c8fbeba5408",
      "required": true,
      "status": "pending",
      "mappings": {
        "narration_segment_ids": [],
        "screen_ids": [],
        "visual_cue_ids": []
      },
      "omission_reason": null
    },
    {
      "source_block_id": "p0002-b0008",
      "page_number": 2,
      "block_type": "figure",
      "semantic_role": "lesson_content",
      "source_text_sha256": "62f6a94f2b7d0e2d835f1cf88e3ca6e332a95830ffcebe305e6117b507cb1ef6",
      "required": true,
      "status": "pending",